{
  "schema": "https://raw.githubusercontent.com/FAIR-bioHeaders/FHR-Specification/main/fhr.json",
  "schemaVersion": 1.0,
  "genome": "Synthetic human reference example",
  "taxon": {
    "name": "Homo sapiens",
    "uri": "https://identifiers.org/taxonomy:9606"
  },
  "version": "0.0.1",
  "metadataAuthor": [
    {
      "name": "Adam Wright",
      "uri": "https://orcid.org/0000-0002-5719-4024"
    }
  ],
  "assemblyAuthor": [
    {
      "name": "David Molik",
      "uri": "https://orcid.org/0000-0003-3192-6538"
    }
  ],
  "dateCreated": "2022-03-21",
  "masking": "soft-masked",
  "checksum": "AAAAAAAAAAAAAAAAAAAAAAAAAAAAAAAAAAAAAAAAAAA="
}
